섹터A,섹터B,종목코드,종목명,시장구분,기존최고가달성일,기존최고가,당일최고가,당일최저가,당일종가,3개월 종가 상승률,1주 종가 상승률,대비,등락률,종료일 거래량,종료일 거래금액(백만원),종료일 시가총액(억원)
"가전제품, 도구 및 가정 용품",53204030,603638,Yantai Eddie Precision Machinery Co Ltd Class A,sse,2026-05-19,26.16,28.12,25.40,27.90,+45.86%,+23.56%,2.03,7.85,"59,812,154","1,668",N/A
개인 생활 필수 용품,54201020,603983,Guangdong Marubi Biotechnology Co Ltd Class A,sse,2026-07-01,29.13,29.43,26.79,29.16,+19.70%,+25.42%,1.39,5.01,"11,775,133",343,N/A
건설 및 엔지니어링,52201020,605178,Beijing New Space Technology Co Ltd Class A,sse,2026-07-02,112.28,122.44,105.89,120.06,+81.61%,+35.66%,7.78,6.93,"9,956,879","1,195",N/A
반도체,57101010,600360,JiLin Sino-Microelectronics Co Ltd Class A,sse,2026-06-30,14.66,15.51,13.57,14.96,+67.05%,+12.48%,0.86,6.1,"185,997,875","2,782",N/A
반도체,57101010,600601,Founder Technology Group Co Ltd Class A,sse,2026-07-02,14.92,15.76,14.41,15.12,+57.01%,+16.31%,0.20,1.34,"480,231,750","7,261",N/A
반도체,57101010,688141,JoulWatt Technology Co Ltd Class A,sse,2026-06-30,153.50,163.31,139.07,156,+200.17%,+6.27%,11.79,8.18,"19,428,542","3,030",N/A
"배달, 우편, 항공 화물 및 육상 물류",52405010,603713,Milkyway Intelligent Supply Chain Service Group Co Ltd Class A,sse,2026-07-01,76.65,79.23,72.52,79.23,+37.36%,+4.22%,7.20,10.0,"3,613,427",286,N/A
산업용 기계 및 장비,52102010,603662,Keli Sensing Technology Ningbo Co Ltd Class A,sse,2026-07-01,74.63,81.20,73.53,80,+50.21%,+23.02%,6.18,8.37,"35,725,583","2,858",N/A
산업용 기계 및 장비,52102010,688017,Leader Harmonious Drive Systems Co Ltd Class A,sse,2026-06-08,428.25,495.66,416.20,488,+160.54%,+32.08%,74.95,18.15,"26,943,070","13,148",N/A
산업용 기계 및 장비,52102010,688112,Siglent Technologies Co Ltd Class A,sse,2026-07-02,80.30,88.77,77.88,84.91,+113.16%,+21.47%,4.61,5.74,"6,788,753",576,N/A
산업용 기계 및 장비,52102010,688400,LUSTER LightTech Co Ltd Class A,sse,2026-06-18,69.09,73.98,66.22,71.41,+65.19%,+8.39%,5.91,9.02,"36,302,921","2,592",N/A
상품 화학,51101010,688219,Orinko Advanced Plastics Co Ltd Class A,sse,2026-07-01,12.99,13.49,12.61,13.38,+32.51%,+7.64%,0.51,3.96,"27,534,501",368,N/A
생명 공학 및 의학 연구,56202010,688578,Shanghai Allist Pharmaceuticals Co Ltd Class A,sse,2026-07-02,130.87,134,122.84,130.88,+35.22%,+40.02%,0.01,0.01,"18,505,030","2,421",N/A
소프트웨어,57201020,688168,Beijing ABT Networks Co Ltd Class A,sse,2026-07-01,72.43,75.55,70.61,73.80,+52.25%,+15.47%,1.82,2.53,"4,283,140",316,N/A
소프트웨어,57201020,688207,Beijing Deep Glint Technology Co Ltd Class A,sse,2026-07-01,22.59,24.09,22.39,22.84,+69.69%,+18.96%,0.26,1.15,"34,703,461",792,N/A
"오일, 가스 정제 및 마케팅",50102030,603223,Hengtong Logistics Co Ltd Class A,sse,2026-07-02,13.46,14.43,13.46,14.15,+71.37%,+18.02%,0.69,5.13,"34,281,409",485,N/A
의류 및 액세서리,53202020,600177,Youngor Fashion Co Ltd Class A,sse,2026-07-02,7.83,7.91,7.76,7.83,+6.34%,+4.26%,0,0.0,"24,234,846",189,N/A
의류 및 액세서리,53202020,600400,Jiangsu Hongdou Industrial Co Ltd Class A,sse,2026-07-01,3.46,3.55,3.34,3.46,+67.96%,+5.81%,0.07,2.06,"74,015,850",256,N/A
"자동차, 트럭 및 오토바이 부품",53101020,603006,Shanghai Lianming Machinery Co Ltd Class A,sse,2026-07-02,14.61,15.02,14.39,14.82,+21.46%,+6.77%,0.21,1.44,"9,389,302",139,N/A
"자동차, 트럭 및 오토바이 부품",53101020,603040,Hangzhou XZB Tech Co Ltd Class A,sse,2026-07-01,69.38,73.28,67.93,71.71,+32.61%,+15.05%,3.44,5.04,"7,344,470",526,N/A
"자동차, 트럭 및 오토바이 부품",53101020,603358,Huada Automotive Technology Corp Ltd Class A,sse,2026-06-30,43.50,44.79,42.56,44.04,+25.20%,+7.52%,1.52,3.57,"14,196,232",625,N/A
전기 부품 및 장비,52102030,605288,Changzhou Kaidi Electrical Inc Class A,sse,2026-07-02,89.40,95.59,87.02,95.18,+55.73%,+22.25%,5.78,6.47,"3,321,374",316,N/A
전기 부품 및 장비,52102030,688320,Zhejiang Hechuan Technology Co Ltd Class A,sse,2026-05-15,42,44.25,40.43,42.95,+48.51%,+16.62%,1.64,3.97,"14,060,071",603,N/A
전자 장비 및 부품,57104010,600885,Hongfa Technology Co Ltd Class A,sse,2026-07-01,37.94,38.98,35.98,38.09,+50.56%,+15.81%,1.77,4.87,"35,045,676","1,334",N/A
전자 장비 및 부품,57104010,688333,XiAn Bright Laser Technologies Co Ltd Class A,sse,2026-07-02,110.10,115.19,108,112.10,+25.38%,+11.21%,2,1.82,"18,650,551","2,090",N/A
전자 장비 및 부품,57104010,688661,Suzhou UIGreen Micro & Nano Technologies Co Ltd Class A,sse,2026-06-30,158.98,177,153.50,174.37,+134.21%,+17.66%,17.86,11.41,"7,272,449","1,268",N/A
제약,56201040,603669,Lionco Pharmaceutical Group Co Ltd Class A,sse,2026-07-02,6.06,6.14,5.85,6.12,+24.14%,+10.47%,0.06,0.99,"44,417,144",271,N/A
제약,56201040,688117,ChengDu Sheng Nuo Biotec Co Ltd Class A,sse,2026-07-02,29.20,30.55,29.09,30.08,+20.66%,+27.51%,0.88,3.01,"12,028,750",361,N/A
제약,56201040,688221,Frontier Biotechnologies Inc Class A,sse,2026-07-02,27.33,28.12,26.55,27.73,+35.86%,+41.34%,0.40,1.46,"32,271,274",894,N/A
제약,56201040,688266,Suzhou Zelgen Biopharmaceuticals Co Ltd Class A,sse,2026-07-02,136.31,146.02,125.69,143,+43.72%,+33.90%,6.69,4.91,"14,426,183","2,062",N/A
제약,56201040,688506,Sichuan Biokin Pharmaceutical Co Ltd Class A,sse,2026-07-02,335.50,349,314,340,+8.44%,+29.48%,4.50,1.34,"4,419,142","1,502",N/A
첨단 의료 장비 및 기술,56101010,688114,MGI Tech Co Ltd Class A,sse,2026-05-20,54.94,61.39,50.92,58.99,+22.28%,+22.21%,7.08,13.64,"15,162,585",894,N/A
통합 하드웨어 및 소프트웨어,57107010,688165,EFORT Intelligent Robot Co Ltd Class A,sse,2026-05-22,22.10,24.25,21.28,23.26,+46.47%,+29.94%,2.09,9.87,"38,456,611",894,N/A
투자 은행 및 중개 서비스,55102010,601211,Guotai Haitong Securities Co Ltd Class A,sse,2026-07-02,19.17,19.58,19.08,19.37,+19.92%,+11.32%,0.20,1.04,"138,505,599","2,682",N/A
투자 은행 및 중개 서비스,55102010,601881,China Galaxy Securities Co Ltd Class A,sse,2026-07-01,13.13,13.82,12.92,13.44,+7.61%,+7.78%,0.49,3.78,"111,018,499","1,492",N/A
특수 채굴 및 금속,51201050,600366,Ningbo Yunsheng Co Ltd Class A,sse,2026-07-02,16.63,17.35,16.36,16.83,+45.23%,+18.77%,0.20,1.2,"112,729,271","1,897",N/A
특수 채굴 및 금속,51201050,688102,Shaanxi Sirui Advanced Materials Co Ltd Class A,sse,2026-07-01,47.87,49.32,46,48.61,+41.35%,+10.38%,2.33,5.03,"38,832,757","1,887",N/A
특수 화학제,51101030,600889,Nanjing Chemical Fibre Co Ltd Class A,sse,2026-05-27,16.67,16.86,16.08,16.77,+25.15%,+11.43%,0.71,4.42,"7,166,139",120,N/A
항공우주 및 방위,52101010,688685,Jiangsu Maixinlin Aviation Science and Technology Corp Class A,sse,2026-05-13,56.34,59.88,54.05,57.45,+48.02%,+6.47%,3.14,5.78,"13,117,832",753,N/A
환경 서비스 및 장비,52203010,603588,Beijing GeoEnviron Engineering & Technology Inc Class A,sse,2026-07-01,19.65,20.70,18.28,19.80,+28.50%,+4.05%,0.95,5.04,"131,197,734","2,597",N/A
