섹터A,섹터B,종목코드,종목명,시장구분,기존최고가달성일,기존최고가,당일최고가,당일최저가,당일종가,3개월 종가 상승률,1주 종가 상승률,대비,등락률,종료일 거래량,종료일 거래금액(백만원),종료일 시가총액(억원)
개인 생활 필수 용품,54201020,603983,Guangdong Marubi Biotechnology Co Ltd Class A,sse,2026-07-03,29.16,31.30,28.48,31.21,+28.38%,+22.01%,2.05,7.03,"10,229,995",319,N/A
고속도로 및 철도,52407030,600350,Shandong Hi-speed Co Ltd Class A,sse,2026-05-25,12.04,12.14,11.63,12.11,+21.62%,+9.20%,0.24,2.02,"6,675,672",80,N/A
금 제외 귀금속 및 광물,51201010,600172,Henan Huanghe Whirlwind Co Ltd Class A,sse,2026-06-25,18.27,18.55,16.67,18.55,+128.45%,+14.79%,1.69,10.02,"284,171,864","5,271",N/A
반도체,57101010,688141,JoulWatt Technology Co Ltd Class A,sse,2026-07-03,156,171.10,154.95,166.48,+201.05%,+16.78%,10.48,6.72,"18,067,911","3,007",N/A
반도체,57101010,688249,Nexchip Semiconductor Corp Class A,sse,2026-07-01,61.28,63.30,54.89,61.61,+117.63%,+3.97%,0.51,0.83,"85,017,975","5,237",N/A
반도체,57101010,688362,Forehope Electronic Ningbo Co Ltd Class A,sse,2026-06-30,96.40,103.38,85.18,96.50,+142.46%,+13.60%,6.50,7.22,"49,038,351","4,732",N/A
"배달, 우편, 항공 화물 및 육상 물류",52405010,601156,Eastern Air Logistics Co Ltd Class A,sse,2026-07-02,17.81,18.38,17.60,17.91,+6.35%,+9.41%,0.11,0.62,"18,589,567",332,N/A
산업용 기계 및 장비,52102010,603032,Delixi New Energy Technology Co Ltd Class A,sse,2026-05-28,27.64,30.36,28.10,29.90,+71.93%,+11.28%,2.30,8.33,"34,892,920","1,043",N/A
산업용 기계 및 장비,52102010,603757,Zhejiang Dayuan Pumps Industry Co Ltd Class A,sse,2026-06-30,75.76,79.19,70.31,79.19,+77.57%,+12.49%,7.20,10.0,"15,749,509","1,247",N/A
생명 공학 및 의학 연구,56202010,688222,HitGen Inc Class A,sse,2026-07-01,33.32,34.84,31.82,33.67,+30.84%,+2.56%,1.26,3.89,"27,844,261",937,N/A
생명 공학 및 의학 연구,56202010,688235,BeOne Medicines AG Class A,sse,2026-05-12,267.98,288.96,260.50,276.50,+16.61%,+8.05%,9.54,3.57,"10,257,278","2,836",N/A
생명 공학 및 의학 연구,56202010,688578,Shanghai Allist Pharmaceuticals Co Ltd Class A,sse,2026-07-03,130.88,137.20,124.05,131.23,+37.45%,+22.63%,0.35,0.27,"18,791,866","2,466",N/A
생명 및 건강 보험,55301030,601628,China Life Insurance Co Ltd Class A,sse,2026-07-01,38.78,39.28,38.05,38.83,+8.80%,+8.65%,0.17,0.44,"38,798,913","1,506",N/A
소프트웨어,57201020,688168,Beijing ABT Networks Co Ltd Class A,sse,2026-07-03,73.80,76.78,68.84,74.60,+55.44%,+15.87%,0.80,1.08,"7,366,961",549,N/A
"오일, 가스 정제 및 마케팅",50102030,603223,Hengtong Logistics Co Ltd Class A,sse,2026-07-03,14.15,15.35,13.85,14.48,+71.66%,+15.75%,0.33,2.33,"40,042,297",579,N/A
"의료 장비, 물품 및 유통",56101020,688068,Beijing Hotgen Biotech Co Ltd Class A,sse,2026-04-15,126.25,143.99,115.88,132,+4.76%,+55.50%,9.03,7.34,"9,389,136","1,239",N/A
"자동차, 트럭 및 오토바이 부품",53101020,603211,Jintuo Technology Co Ltd Class A,sse,2026-06-23,37,39.53,37,39.53,+66.65%,+22.46%,3.59,9.99,"13,121,900",518,N/A
"자동차, 트럭 및 오토바이 부품",53101020,603358,Huada Automotive Technology Corp Ltd Class A,sse,2026-07-03,44.04,45.88,42.82,44.37,+32.50%,+6.28%,0.33,0.75,"13,286,982",589,N/A
"자동차, 트럭 및 오토바이 부품",53101020,603950,Xiangyang Changyuandonggu Industry Co Ltd Class A,sse,2026-07-01,87.30,92.09,85.62,88.26,+138.42%,+15.00%,4.54,5.42,"15,981,383","1,410",N/A
전기 부품 및 장비,52102030,688103,Kunshan Guoli Electronic Technology Co Ltd Class A,sse,2026-07-02,74.62,87.61,71.51,85.34,+63.83%,+27.99%,12.33,16.89,"8,807,957",751,N/A
전자 장비 및 부품,57104010,600885,Hongfa Technology Co Ltd Class A,sse,2026-07-03,38.09,40.41,37.16,38.18,+55.60%,+11.67%,0.09,0.24,"36,904,395","1,409",N/A
전자 장비 및 부품,57104010,688206,Primarius Technologies Co Ltd Class A,sse,2026-07-01,48.20,48.76,42.47,48.76,+58.26%,+14.92%,8.13,20.01,"23,834,467","1,162",N/A
전자 장비 및 부품,57104010,688629,Sichuan Huafeng Technology Co Ltd Class A,sse,2026-06-30,187.51,212.58,183.30,200.49,+71.74%,+17.25%,20.49,11.38,"32,611,573","6,538",N/A
제약,56201040,603087,Gan & Lee Pharmaceuticals Class A,sse,2026-04-16,64.73,67.09,60.71,67.09,+8.71%,+16.54%,6.10,10.0,"22,359,043","1,500",N/A
제약,56201040,688117,ChengDu Sheng Nuo Biotec Co Ltd Class A,sse,2026-07-03,30.08,32.20,29.84,30.62,+21.49%,+14.34%,0.54,1.8,"14,923,401",456,N/A
투자 은행 및 중개 서비스,55102010,601211,Guotai Haitong Securities Co Ltd Class A,sse,2026-07-03,19.37,20.50,19.17,19.69,+23.25%,+8.60%,0.32,1.65,"249,991,212","4,922",N/A
투자 은행 및 중개 서비스,55102010,601881,China Galaxy Securities Co Ltd Class A,sse,2026-07-03,13.44,13.78,13.41,13.49,+8.62%,+7.15%,0.05,0.37,"82,642,052","1,114",N/A
특수 채굴 및 금속,51201050,688231,Jiangsu Longda Superalloy Co Ltd Class A,sse,2026-05-22,41.41,44.98,40.13,43.75,+98.62%,+27.92%,3.05,7.49,"11,845,731",518,N/A
특수 화학제,51101030,603078,Jiangyin Jianghua Micro-electronic Materials Co Ltd Class A,sse,2026-07-02,56.90,59.49,50.98,57.51,+165.61%,+28.00%,1.25,2.22,"61,547,433","3,539",N/A
특수 화학제,51101030,603823,Lily Group Co Ltd Class A,sse,2026-07-02,61.22,65.87,59.50,65.26,+332.27%,+31.55%,5.38,8.98,"27,051,347","1,765",N/A
